Название раздела,Описание,Создатель,Email создателя,Дата создания,Количество тем,Количество постов,Уникальных авторов,Последняя активность
Общие вопросы,"Обсуждение общих вопросов, не относящихся к другим разделам",user3,user3@gadukagang.com,2025-12-01 13:23:02,9,63,12,2025-12-01 13:33
Python,Все о языке программирования Python,user1,user1@gadukagang.com,2025-12-01 13:23:02,8,46,11,2025-12-01 13:33
Веб-разработка,Фронтенд и бэкенд разработка веб-приложений,user1,user1@gadukagang.com,2025-12-01 13:23:02,9,52,12,2025-12-01 13:33
Базы данных,Реляционные и нереляционные базы данных,user4,user4@gadukagang.com,2025-12-01 13:23:02,2,14,9,2025-12-01 13:33
Кибербезопасность,Защита информации и сетевая безопасность,user2,user2@gadukagang.com,2025-12-01 13:23:02,4,26,11,2025-12-01 13:33
Мобильная разработка,Разработка мобильных приложений,admin,admin@gadukagang.com,2025-12-01 13:23:02,3,9,6,2025-12-01 13:33
Сообщества,Темы из сообществ,Система,,2025-12-01 16:46:38,5,5,2,2025-12-26 20:40
